org,repository,url,state,created_at,merged_at,user.login,title
"gradle","gradle","https://github.com/gradle/gradle/pull/16619","closed","2021-03-23T15:30:44Z","2021-03-29T09:23:06Z","wolfs","Keep a project scope input node access hierarchy"
"gradle","gradle","https://github.com/gradle/gradle/pull/16640","closed","2021-03-25T11:16:34Z","2021-03-25T16:06:19Z","rieske","Fix compilation avoidance test"
"gradle","gradle","https://github.com/gradle/gradle/pull/16639","closed","2021-03-25T09:35:28Z","2021-03-25T13:59:16Z","rieske","Remove extra dot from release notes"
"gradle","gradle-profiler","https://github.com/gradle/gradle-profiler/pull/329","closed","2021-03-22T18:23:07Z","2021-03-24T17:30:49Z","wolfs","Create differential flame graphs for async-profiler or JFR"
"gradle","gradle","https://github.com/gradle/gradle/pull/16594","closed","2021-03-19T21:39:29Z","2021-03-20T00:59:47Z","lptr","Use InputFingerprinter to capture transform parameters"
"gradle","gradle","https://github.com/gradle/gradle/pull/16617","closed","2021-03-23T09:28:39Z","2021-03-24T09:38:00Z","eskatos","Upgrade tested AGP versions"
"gradle","gradle","https://github.com/gradle/gradle/pull/16614","closed","2021-03-22T23:35:15Z","2021-03-23T16:13:09Z","urdak","Fix native-platform sourcesetvariant test on gcc10"
"gradle","gradle","https://github.com/gradle/gradle/pull/16607","closed","2021-03-22T11:39:38Z","2021-03-22T14:50:47Z","ljacomet","Do not manage locking in plugins resolution context"
"gradle","gradle-profiler","https://github.com/gradle/gradle-profiler/pull/328","closed","2021-03-19T09:48:13Z","2021-03-21T10:01:16Z","wolfs","Support capturing multiple events with async profiler"
"gradle","gradle","https://github.com/gradle/gradle/pull/16573","closed","2021-03-18T15:48:02Z","2021-03-19T21:16:09Z","lptr","Standardize transform identity calculation"
"gradle","gradle","https://github.com/gradle/gradle/pull/16590","closed","2021-03-19T15:55:16Z","2021-03-19T17:02:34Z","eskatos","Re-enable kotlin-dsl script caching soak test"
"gradle","gradle","https://github.com/gradle/gradle/pull/16574","closed","2021-03-18T16:25:18Z","2021-03-19T17:04:49Z","ljacomet","Version catalog: restrict import and disconnect from platform plugin"
"gradle","test-retry-gradle-plugin","https://github.com/gradle/test-retry-gradle-plugin/pull/98","closed","2021-03-18T15:18:52Z","2021-03-19T08:24:44Z","marcphilipp","Fix publishing via maven-publish plugin"
"gradle","gradle","https://github.com/gradle/gradle/pull/16559","closed","2021-03-17T05:27:45Z","2021-03-18T05:46:20Z","blindpirate","Remove ModuleIdentityExtension from unnecessary module"
"gradle","gradle","https://github.com/gradle/gradle/pull/16575","closed","2021-03-18T16:27:21Z","2021-03-18T19:12:20Z","eskatos","Upgrade tested AGP version"
"gradle","gradle","https://github.com/gradle/gradle/pull/16569","closed","2021-03-18T05:41:49Z","2021-03-18T14:41:25Z","big-guy","Remove unused tests and make existing tests work again"
"gradle","gradle","https://github.com/gradle/gradle/pull/16571","closed","2021-03-18T09:18:49Z","2021-03-18T13:12:13Z","rieske","Mark test-kit tests as multi-version tests"
"gradle","gradle","https://github.com/gradle/gradle/pull/16570","closed","2021-03-18T06:40:29Z","2021-03-18T13:10:24Z","adammurdoch","Change configuration cache serialization to handle project transform nodes that have not been scheduled"
"gradle","gradle","https://github.com/gradle/gradle/pull/16561","closed","2021-03-17T10:05:37Z","2021-03-18T08:50:11Z","eskatos","Upgrade tested AGP versions"
"gradle","gradle-profiler","https://github.com/gradle/gradle-profiler/pull/326","closed","2021-03-17T17:43:02Z","2021-03-18T07:05:11Z","wolfs","Consolidate file layout for profiles and flame graphs"
"gradle","gradle","https://github.com/gradle/gradle/pull/16565","closed","2021-03-17T15:10:28Z","2021-03-18T00:09:28Z","ljacomet","Remove filtering feature from catalog import"
"gradle","gradle","https://github.com/gradle/gradle/pull/16548","closed","2021-03-16T13:37:34Z","2021-03-17T11:34:41Z","rieske","Use command line argument provider for samples tests system property"
"gradle","gradle","https://github.com/gradle/gradle/pull/16553","closed","2021-03-16T16:29:09Z","2021-03-16T20:57:50Z","wolfs","Upgrade tested version of nebula plugin plugin"
"gradle","gradle","https://github.com/gradle/gradle/pull/16554","closed","2021-03-16T16:48:12Z","2021-03-16T18:00:06Z","bamboo","Update wrapper to latest nightly"
"gradle","gradle","https://github.com/gradle/gradle/pull/16547","closed","2021-03-16T13:04:58Z","2021-03-16T14:55:00Z","eskatos","Fix deprecation message of Kotlin DSL eager extensions for Configuration accessors"
