org,repository,url,state,created_at,merged_at,user.login,title
"gradle","android-cache-fix-gradle-plugin","https://github.com/gradle/android-cache-fix-gradle-plugin/pull/151","closed","2021-03-03T12:43:36Z","2021-03-04T14:52:33Z","runningcode","Disable caching of MergeJavaResources, StripDebugSymbols"
"gradle","android-cache-fix-gradle-plugin","https://github.com/gradle/android-cache-fix-gradle-plugin/pull/152","closed","2021-03-04T09:38:58Z","2021-03-04T14:45:49Z","runningcode","Add stricter plugin validation."
"gradle","gradle","https://github.com/gradle/gradle/pull/16534","closed","2021-03-15T13:47:23Z","2021-03-16T05:54:53Z","melix","Add unit tests for validation message rendering"
"gradle","gradle","https://github.com/gradle/gradle/pull/16499","closed","2021-03-11T15:31:45Z","2021-03-12T14:41:47Z","melix","Improve the validation error message layout"
"gradle","gradle","https://github.com/gradle/gradle/pull/16351","closed","2021-03-01T02:08:06Z","2021-03-03T07:46:21Z","ldaley","Use unique settings class loader scope for each build in tree"
"gradle","gradle","https://github.com/gradle/gradle/pull/16396","closed","2021-03-03T12:25:12Z","2021-03-04T13:25:04Z","donat","Use Spock 2 consistently in build and documentation"
"gradle","gradle","https://github.com/gradle/gradle/pull/16492","closed","2021-03-10T15:36:14Z","2021-03-10T22:29:25Z","bmuskalla","Update release and upgrade notes for Groovy 3"
"gradle","gradle","https://github.com/gradle/gradle/pull/16376","closed","2021-03-02T10:26:49Z","2021-03-02T21:02:14Z","eskatos","Update kotlin-dsl-conventions plugin in gradle/gradle build"
"gradle","playframework","https://github.com/gradle/playframework/pull/163","closed","2021-03-12T04:58:23Z","2021-03-29T23:20:43Z","iaco86","Play 2.8 support"
"gradle","gradle","https://github.com/gradle/gradle/pull/16481","closed","2021-03-09T22:38:31Z","2021-05-18T12:35:37Z","mathjeff","Have DefaultExecutionPlan exit early if no worker leases are available"
"gradle","gradle","https://github.com/gradle/gradle/pull/16483","closed","2021-03-10T05:29:25Z","2021-05-07T01:09:28Z","DanielThomas","Improve performance of dependency resolution on worker constrained hosts"
"gradle","gradle","https://github.com/gradle/gradle/pull/16519","closed","2021-03-14T16:58:42Z","2021-05-04T06:08:24Z","sschuberth","Fix the order in which the wrapper parses properties"
"gradle","gradle","https://github.com/gradle/gradle/pull/16495","closed","2021-03-10T22:16:09Z","2021-04-27T14:17:52Z","asodja","Incremental Java compilation on public constant change"
"gradle","gradle","https://github.com/gradle/gradle/pull/16538","closed","2021-03-15T16:50:33Z","2021-03-16T14:58:57Z","ljacomet","Version catalog clean ups"
"gradle","gradle","https://github.com/gradle/gradle/pull/16537","closed","2021-03-15T16:40:02Z","2021-04-20T15:43:45Z","melix","Fix potential `NoClassDefFoundError`"
"gradle","gradle","https://github.com/gradle/gradle/pull/16536","closed","2021-03-15T16:31:06Z","2021-04-08T06:09:39Z","oehme","Overhaul incremental compiler"
"gradle","gradle","https://github.com/gradle/gradle/pull/16528","closed","2021-03-15T10:23:27Z","2021-03-15T12:15:55Z","snoopcheri","Update test-distribution plugin to released version 2.0"
"gradle","gradle","https://github.com/gradle/gradle/pull/16460","closed","2021-03-08T21:38:53Z","2021-03-12T21:37:30Z","mvitaly","Fix AbstractClassLoaderCache package name"
"gradle","gradle","https://github.com/gradle/gradle/pull/16400","closed","2021-03-03T16:13:24Z","2021-03-11T17:29:38Z","jdochez","Fix native memory leak by closing zip streams"
"gradle","gradle","https://github.com/gradle/gradle/pull/16453","closed","2021-03-08T16:43:59Z","2021-03-10T14:17:45Z","Dobiasd","Fix the second link to the Gradle Kotlin DSL Primer"
"gradle","gradle","https://github.com/gradle/gradle/pull/16520","closed","2021-03-15T01:09:20Z","2021-03-15T05:51:39Z","blindpirate","Test pre-tested commit"
"gradle","gradle","https://github.com/gradle/gradle/pull/16524","closed","2021-03-15T07:13:54Z","2021-03-17T03:40:37Z","blindpirate","Remove unncessary def"
"gradle","gradle","https://github.com/gradle/gradle/pull/16522","closed","2021-03-15T01:11:06Z","2021-03-15T06:51:02Z","blindpirate","Test pre-tested commit"
"gradle","gradle","https://github.com/gradle/gradle/pull/16502","closed","2021-03-12T02:09:34Z","2021-03-12T08:18:48Z","big-guy","Clean up generated Probe class"
"gradle","gradle","https://github.com/gradle/gradle/pull/16533","closed","2021-03-15T13:21:31Z","2021-03-17T07:39:21Z","britter","Update to Gradle Enterprise Gradle plugin 3.6"
"gradle","gradle","https://github.com/gradle/gradle/pull/16389","closed","2021-03-02T21:36:27Z","2021-03-03T00:18:07Z","bamboo","Let the configuration cache serialize primitive arrays"
"gradle","gradle","https://github.com/gradle/gradle/pull/16477","closed","2021-03-09T20:41:20Z","2021-03-09T20:44:00Z","bamboo","Let classpath transformer use a separate lock file"
"gradle","gradle","https://github.com/gradle/gradle/pull/16476","closed","2021-03-09T20:36:35Z","2021-03-10T00:32:15Z","bamboo","Polish `:configuration-cache` project"
"gradle","gradle","https://github.com/gradle/gradle/pull/16479","closed","2021-03-09T21:11:05Z","2021-03-10T00:32:23Z","bamboo","Update wrapper to latest nightly"
"gradle","gradle","https://github.com/gradle/gradle/pull/16530","closed","2021-03-15T11:19:36Z","2021-03-16T13:00:56Z","ljacomet","Improve JCenter shut down message"
"gradle","gradle","https://github.com/gradle/gradle/pull/16463","closed","2021-03-09T06:06:26Z","2021-03-14T15:50:27Z","blindpirate","Preparation for pre-tested commit"
"gradle","gradle","https://github.com/gradle/gradle/pull/16525","closed","2021-03-15T09:36:36Z","2021-03-15T15:00:41Z","wolfs","Improve Javadoc for ValidatePlugins"
"gradle","gradle","https://github.com/gradle/gradle/pull/16526","closed","2021-03-15T09:59:52Z","2021-03-15T13:10:35Z","ljacomet","Locking improvements documentation"
"gradle","gradle","https://github.com/gradle/gradle/pull/16529","closed","2021-03-15T10:28:56Z","2021-03-15T11:07:25Z","rieske","Enable incremental compilation with Java records "
"gradle","gradle-enterprise-build-config-samples","https://github.com/gradle/gradle-enterprise-build-config-samples/pull/78","closed","2021-03-04T09:56:50Z","2021-03-15T10:21:05Z","runningcode","Enable stricter plugin validation."
"gradle","gradle","https://github.com/gradle/gradle/pull/16515","closed","2021-03-14T08:38:24Z","2021-03-15T08:56:54Z","sschuberth","docs: Trivially fix a typo in release notes for version 7"
"gradle","gradle","https://github.com/gradle/gradle/pull/16441","closed","2021-03-08T01:09:43Z","2021-03-08T05:12:09Z","blindpirate","Check existence of virtual disk before subst"
"gradle","gradle","https://github.com/gradle/gradle/pull/16518","closed","2021-03-14T15:23:32Z","2021-03-14T15:30:01Z","blindpirate","Test pre-tested commit"
"gradle","gradle","https://github.com/gradle/gradle/pull/16517","closed","2021-03-14T12:16:15Z","2021-03-14T15:11:34Z","blindpirate","Not run build on same revision if it's already built"
"gradle","gradle","https://github.com/gradle/gradle/pull/16510","closed","2021-03-12T14:21:35Z","2021-03-12T15:56:49Z","snoopcheri","Update Test Distribution plugin to version 2.0-rc-8"
"gradle","gradle","https://github.com/gradle/gradle/pull/16478","closed","2021-03-09T21:02:08Z","2021-03-12T14:32:47Z","lptr","Add basic detection of supported file systems"
"gradle","gradle","https://github.com/gradle/gradle/pull/16507","closed","2021-03-12T13:44:43Z","2021-03-12T14:14:06Z","wolfs","Update performance improvements section"
"gradle","gradle","https://github.com/gradle/gradle/pull/16421","closed","2021-03-04T18:14:22Z","2021-03-11T22:23:57Z","ljacomet","Improvements to dependency locking"
"gradle","gradle-profiler","https://github.com/gradle/gradle-profiler/pull/322","closed","2021-03-01T09:21:47Z","2021-03-01T10:53:21Z","wolfs","Do not publish snapshots or alphas to SDKman"
"gradle","gradle","https://github.com/gradle/gradle/pull/16484","closed","2021-03-10T05:58:00Z","2021-03-12T01:07:45Z","blindpirate","Update build type ids for expected cache miss"
"gradle","gradle","https://github.com/gradle/gradle/pull/16380","closed","2021-03-02T12:48:50Z","2021-03-11T22:24:59Z","ljacomet","Build repositories content filtering"
"gradle","gradle","https://github.com/gradle/gradle/pull/16487","closed","2021-03-10T10:42:16Z","2021-03-11T12:50:52Z","snoopcheri","Update test-distribution plugin to version 2.0-rc-7"
"gradle","gradle","https://github.com/gradle/gradle/pull/16494","closed","2021-03-10T18:01:26Z","2021-03-11T08:22:10Z","ljacomet","Delete dead code"
"gradle","gradle","https://github.com/gradle/gradle/pull/16471","closed","2021-03-09T12:11:11Z","2021-03-10T17:40:43Z","donat","Make invokeMethod() work in withGroovybuilder block"
"gradle","gradle","https://github.com/gradle/gradle/pull/16493","closed","2021-03-10T16:18:26Z","2021-03-10T16:58:04Z","wolfs","Test newer version of Fladle plugin"
"gradle","gradle","https://github.com/gradle/gradle/pull/16489","closed","2021-03-10T14:22:51Z","2021-03-10T16:57:10Z","wolfs","Add plugin validation smoke test for ProGuard task"
"gradle","gradle","https://github.com/gradle/gradle/pull/16472","closed","2021-03-09T12:39:26Z","2021-03-09T22:53:01Z","rieske","Remove deprecated internal JPMS arguments class and update build logic"
"gradle","gradle","https://github.com/gradle/gradle/pull/16470","closed","2021-03-09T11:57:15Z","2021-03-10T13:48:59Z","rieske","Mention Java 16 support in release notes and compatibility doc"
"gradle","gradle","https://github.com/gradle/gradle/pull/16454","closed","2021-03-08T17:38:06Z","2021-03-10T11:06:13Z","melix","Add validation smoke test for the node plugin"
"gradle","gradle","https://github.com/gradle/gradle/pull/16473","closed","2021-03-09T14:41:38Z","2021-03-10T10:04:20Z","eskatos","Upgraded smoke tested AGP versions"
"gradle","gradle","https://github.com/gradle/gradle/pull/16456","closed","2021-03-08T18:23:29Z","2021-03-10T08:02:26Z","wolfs","Add plugin validation smoke tests for popular Android plugins"
"gradle","gradle","https://github.com/gradle/gradle/pull/16462","closed","2021-03-09T02:35:56Z","2021-03-10T06:01:53Z","blindpirate","Unmount virtual disk before mounting it"
"gradle","gradle","https://github.com/gradle/gradle/pull/16465","closed","2021-03-09T08:29:04Z","2021-03-10T07:10:47Z","rieske","Fix precompiled plugin id deduction with .gradle substring in id"
"gradle","gradle","https://github.com/gradle/gradle/pull/16466","closed","2021-03-09T09:12:58Z","2021-03-10T07:10:23Z","rieske","Add a test for pluginManagement block in settings plugin"
"gradle","gradle","https://github.com/gradle/gradle/pull/16469","closed","2021-03-09T11:44:21Z","2021-03-09T12:46:35Z","rieske","Use JDK16 as max java and JDK17 as experimental java in CI"
"gradle","gradle","https://github.com/gradle/gradle/pull/16464","closed","2021-03-09T07:56:54Z","2021-03-09T11:10:08Z","rieske","Use JDK16 as max java and JDK17 as experimental java in CI"
"gradle","gradle","https://github.com/gradle/gradle/pull/16468","closed","2021-03-09T11:41:32Z","2021-03-09T11:41:55Z","rieske","Revert ""Use JDK16 as max java and JDK17 as experimental java in CI"""
"gradle","gradle","https://github.com/gradle/gradle/pull/16450","closed","2021-03-08T12:26:21Z","2021-03-09T09:20:47Z","bmuskalla","Fix filtering for duplicate imports"
"gradle","gradle","https://github.com/gradle/gradle/pull/16416","closed","2021-03-04T16:08:24Z","2021-03-09T07:54:29Z","snoopcheri","Update test-distribution plugin to version 2.0-rc-6"
"gradle","gradle","https://github.com/gradle/gradle/pull/16442","closed","2021-03-08T05:49:31Z","2021-03-09T02:19:51Z","blindpirate","Not run build on same revision if it's already built"
"gradle","gradle","https://github.com/gradle/gradle/pull/16451","closed","2021-03-08T13:44:56Z","2021-03-08T17:55:35Z","rieske","Adjust smoke tests to work with JDK16"
"gradle","gradle","https://github.com/gradle/gradle/pull/16434","closed","2021-03-05T15:18:01Z","2021-03-08T13:55:51Z","rieske","Set Gradle daemon JPMS arguments in client JVM when testing no-daemon mode"
"gradle","gradle","https://github.com/gradle/gradle/pull/16443","closed","2021-03-08T06:56:33Z","2021-03-08T13:54:29Z","rieske","Allow cross versions tests to run on JDK16 for Gradle 7.0"
"gradle","gradle","https://github.com/gradle/gradle/pull/16444","closed","2021-03-08T07:08:48Z","2021-03-08T13:51:59Z","rieske","Add a note about Groovy precompiled plugins backwards compatibility"
"gradle","gradle","https://github.com/gradle/gradle/pull/16449","closed","2021-03-08T11:46:57Z","2021-03-08T13:29:39Z","jjohannes","Treat TaskNodes from included builds as 'task nodes'"
"gradle","gradle","https://github.com/gradle/gradle/pull/16445","closed","2021-03-08T10:00:43Z","2021-03-08T13:29:19Z","jjohannes","Document includeBuild for plugin builds"
"gradle","gradle","https://github.com/gradle/gradle/pull/16447","closed","2021-03-08T10:34:12Z","2021-03-08T12:26:08Z","lptr","Bump native-platform to 0.22-milestone-11"
"gradle","gradle","https://github.com/gradle/gradle/pull/16446","closed","2021-03-08T10:23:05Z","2021-03-08T12:25:14Z","lptr","Fix DisableCachingByDefault validation on non-Task/TransformAction types"
"gradle","gradle","https://github.com/gradle/gradle/pull/16433","closed","2021-03-05T15:10:40Z","2021-03-08T10:27:43Z","donat","Fix war plugin dependencies "
"gradle","gradle","https://github.com/gradle/gradle/pull/16436","closed","2021-03-05T17:53:55Z","2021-03-08T08:09:51Z","jjohannes","Fix early cyclic include issue"
"gradle","gradle","https://github.com/gradle/gradle/pull/16422","closed","2021-03-04T19:10:02Z","2021-03-05T14:12:06Z","rieske","Add JPMS configuration for config-cache reflective accesses"
"gradle","gradle","https://github.com/gradle/gradle/pull/16430","closed","2021-03-05T12:39:22Z","2021-03-05T13:25:22Z","wolfs","Add smoke tests for the remaining Android plugins"
"gradle","gradle","https://github.com/gradle/gradle/pull/16428","closed","2021-03-05T10:14:23Z","2021-03-05T12:07:03Z","wolfs","Add failing validation warnings to the upgrading guide"
"gradle","gradle","https://github.com/gradle/gradle/pull/16427","closed","2021-03-05T08:32:54Z","2021-03-05T11:58:35Z","donat","Use junit-platform 5.7.1 consistently in the codebase"
"gradle","gradle","https://github.com/gradle/gradle/pull/16426","closed","2021-03-05T08:03:58Z","2021-03-05T09:08:24Z","melix","Remove unused entries from verification metadata"
"gradle","gradle","https://github.com/gradle/gradle/pull/16424","closed","2021-03-04T19:32:53Z","2021-03-05T10:40:45Z","rieske","Add experimental JDK pipeline stages for multiVersionTests"
"gradle","gradle","https://github.com/gradle/gradle/pull/16386","closed","2021-03-02T17:35:33Z","2021-03-03T20:12:25Z","melix","Improve error messages from `ValidationActions`"
"gradle","gradle","https://github.com/gradle/gradle/pull/16410","closed","2021-03-04T10:12:37Z","2021-03-04T18:23:46Z","wolfs","Configure plugin validation outside of the expect block"
"gradle","gradle","https://github.com/gradle/gradle/pull/16415","closed","2021-03-04T14:53:42Z","2021-03-04T18:11:43Z","wolfs","Remove DeprecationMessageBuilder.willBeRemovedInGradle7()"
"gradle","gradle","https://github.com/gradle/gradle/pull/16401","closed","2021-03-03T20:29:46Z","2021-03-04T11:02:45Z","melix","Polish validation warnings"
"gradle","gradle","https://github.com/gradle/gradle/pull/16391","closed","2021-03-03T07:50:41Z","2021-03-04T11:00:54Z","melix","Turn last validation warnings into errors"
"gradle","gradle-enterprise-build-config-samples","https://github.com/gradle/gradle-enterprise-build-config-samples/pull/77","closed","2021-03-04T08:42:39Z","2021-03-04T09:43:09Z","runningcode","Update Common custom user data Maven extension version to 1.4"
"gradle","gradle","https://github.com/gradle/gradle/pull/16393","closed","2021-03-03T09:23:47Z","2021-03-04T07:24:13Z","eskatos","Turn querying mapped provider before execution to an error"
"gradle","gradle","https://github.com/gradle/gradle/pull/16394","closed","2021-03-03T10:59:48Z","2021-03-04T06:59:10Z","wolfs","Remove smoke test for org.samples.greeting"
"gradle","gradle","https://github.com/gradle/gradle/pull/16385","closed","2021-03-02T16:44:31Z","2021-03-04T06:58:19Z","wolfs","Add plugin validation smoke tests for Android plugins"
"gradle","gradle","https://github.com/gradle/gradle/pull/16404","closed","2021-03-04T01:10:24Z","2021-03-04T04:45:14Z","ldaley","Do not allow use of configuration cache with GradleBuild task"
"gradle","android-cache-fix-gradle-plugin","https://github.com/gradle/android-cache-fix-gradle-plugin/pull/150","closed","2021-03-01T12:58:13Z","2021-03-01T15:00:57Z","runningcode","Add documentation on kotlin-dsl usage."
"gradle","gradle","https://github.com/gradle/gradle/pull/16399","closed","2021-03-03T14:35:09Z","2021-03-03T17:28:30Z","rieske","Update gradle wrapper to include latest kotlin-dsl"
"gradle","gradle-enterprise-build-config-samples","https://github.com/gradle/gradle-enterprise-build-config-samples/pull/76","closed","2021-03-03T00:11:54Z","2021-03-03T15:00:48Z","bigdaz","Fix TeamCity integration. Again."
"gradle","gradle","https://github.com/gradle/gradle/pull/16382","closed","2021-03-02T13:14:00Z","2021-03-03T13:28:35Z","rieske","Configure JPMS module accesses for JDK16 compatibility"
"gradle","gradle","https://github.com/gradle/gradle/pull/16392","closed","2021-03-03T08:13:55Z","2021-03-03T12:53:24Z","rieske","Remove JDK16 workaround from kotlin-dsl plugin"
"gradle","gradle","https://github.com/gradle/gradle/pull/16375","closed","2021-03-02T08:16:24Z","2021-03-03T10:04:06Z","bmuskalla","Upgrade to gradle-profiler 0.16"
"gradle","gradle","https://github.com/gradle/gradle/pull/16369","closed","2021-03-01T18:11:51Z","2021-03-02T17:22:08Z","melix","Improve error messages from `LocalTaskNodeExecutor`"
"gradle","gradle","https://github.com/gradle/gradle/pull/16355","closed","2021-03-01T11:48:06Z","2021-03-02T07:50:31Z","melix","Turn incorrect use of input annotation into an error"
"gradle","gradle","https://github.com/gradle/gradle/pull/16378","closed","2021-03-02T11:48:14Z","2021-03-02T15:17:58Z","rieske","Update dependencies used in samples for compatibility with JDK16"
"gradle","gradle","https://github.com/gradle/gradle/pull/16377","closed","2021-03-02T11:45:24Z","2021-03-02T14:55:35Z","eskatos","Make precompiled kotlin-dsl scripts adapters comply with ktlint conventions 0.7.0"
"gradle","gradle","https://github.com/gradle/gradle/pull/16352","closed","2021-03-01T10:15:38Z","2021-03-02T12:42:53Z","donat","Update embedded Kotlin version to 1.4.31"
"gradle","kotlin-dsl-conventions","https://github.com/gradle/kotlin-dsl-conventions/pull/3","closed","2021-03-02T09:32:08Z","2021-03-02T09:41:26Z","eskatos","Upgrade ktlint-gradle to 10.0.0"
"gradle","gradle","https://github.com/gradle/gradle/pull/16365","closed","2021-03-01T17:42:25Z","2021-03-02T08:49:45Z","wolfs","Improve writing the performance test JSON files"
"gradle","gradle","https://github.com/gradle/gradle/pull/16659","closed","2021-03-29T08:55:46Z","2021-05-21T14:06:12Z","sschuberth","docs: Reword the section about executing tasks"
"gradle","gradle-enterprise-build-config-samples","https://github.com/gradle/gradle-enterprise-build-config-samples/pull/79","closed","2021-03-31T13:52:15Z","2021-12-10T21:32:56Z","jthurne","Add scripts to run Gradle Enterprise Trial experiments"
"gradle","gradle","https://github.com/gradle/gradle/pull/16576","closed","2021-03-18T16:31:29Z","2021-03-19T10:03:05Z","melix","Rename tests"
"gradle","gradle","https://github.com/gradle/gradle/pull/16588","closed","2021-03-19T15:45:21Z","2021-03-19T19:25:57Z","ljacomet","Align baseline version for all tests"
"gradle","gradle","https://github.com/gradle/gradle/pull/16551","closed","2021-03-16T15:11:42Z","2021-03-17T13:45:41Z","melix","Polish project accessors"
"gradle","gradle","https://github.com/gradle/gradle/pull/16633","closed","2021-03-24T19:31:57Z","2021-03-25T08:45:10Z","paplorinc","Update test-distribution plugin to version 2.0.2-rc-1"
"gradle","gradle","https://github.com/gradle/gradle/pull/16685","closed","2021-03-31T10:26:18Z","2021-04-01T09:29:43Z","melix","Let versions and bundles use nested accessors"
"gradle","gradle","https://github.com/gradle/gradle/pull/16591","closed","2021-03-19T17:21:06Z","2021-03-19T20:56:48Z","lptr","Remove unused constant"
"gradle","gradle","https://github.com/gradle/gradle/pull/16544","closed","2021-03-16T10:14:12Z","2021-03-16T11:47:35Z","wolfs","Test newer version of coveralls plugin"
"gradle","gradle","https://github.com/gradle/gradle/pull/16545","closed","2021-03-16T11:04:22Z","2021-03-16T19:49:04Z","wolfs","Mention `mustRunAfter` as a solution for missing task dependencies"
"gradle","gradle","https://github.com/gradle/gradle/pull/16550","closed","2021-03-16T15:10:29Z","2021-03-18T22:56:02Z","bmuskalla","Ensure testkit works across groovy version boundaries"
"gradle","gradle","https://github.com/gradle/gradle/pull/16552","closed","2021-03-16T15:21:27Z","2021-03-16T21:23:34Z","paplorinc","Update test-distribution plugin to version 2.0.1"
"gradle","gradle","https://github.com/gradle/gradle/pull/16586","closed","2021-03-19T14:41:30Z","2021-03-19T21:50:42Z","melix","Add missing syntax validation in TOML file"
"gradle","gradle","https://github.com/gradle/gradle/pull/16635","closed","2021-03-24T20:52:31Z","2021-03-30T14:58:12Z","melix","Fix `platform` notation with type-safe project accessors"
"gradle","gradle","https://github.com/gradle/gradle/pull/16690","closed","2021-03-31T17:28:23Z","2021-04-01T15:47:13Z","melix","Improve error reporting in version catalogs"
"gradle","gradle","https://github.com/gradle/gradle/pull/16549","closed","2021-03-16T14:43:50Z","2021-03-16T16:34:59Z","bamboo","Improve configuration cache coverage for the Gradle build"
"gradle","gradle","https://github.com/gradle/gradle/pull/16564","closed","2021-03-17T14:58:37Z","2021-03-17T15:30:36Z","bamboo","Don't let exception during receipt file creation go unnoticed"
"gradle","gradle","https://github.com/gradle/gradle/pull/16566","closed","2021-03-17T15:12:42Z","2021-03-18T12:40:34Z","bamboo","Promote cache cleanup deletion message from `debug` level to `info`"
"gradle","gradle","https://github.com/gradle/gradle/pull/16572","closed","2021-03-18T14:53:25Z","2021-03-18T17:32:39Z","bamboo","Update wrapper to latest nightly"
"gradle","gradle","https://github.com/gradle/gradle/pull/16584","closed","2021-03-19T13:31:05Z","2021-03-19T14:39:54Z","bamboo","Let all `TransformFile` operations complete"
"gradle","gradle","https://github.com/gradle/gradle/pull/16612","closed","2021-03-22T19:31:14Z","2021-03-25T14:56:00Z","bamboo","Let `DefaultCachedClasspathTransformer` schedule all operations at once"
"gradle","gradle","https://github.com/gradle/gradle/pull/16680","closed","2021-03-30T23:47:24Z","2021-04-02T23:18:06Z","bamboo","Let config cache serialization honor convention mapping"
"gradle","gradle","https://github.com/gradle/gradle/pull/16666","closed","2021-03-29T19:10:35Z","2021-03-30T21:43:41Z","bamboo","Move `Either` data type to newly introduced project `data-structures`"
"gradle","gradle","https://github.com/gradle/gradle/pull/16625","closed","2021-03-24T06:49:17Z","2021-04-01T16:30:15Z","rieske","Support pluginManagement block in precompiled Groovy settings plugins"
"gradle","gradle","https://github.com/gradle/gradle/pull/16637","closed","2021-03-25T06:48:35Z","2021-04-01T12:16:51Z","rieske","Upgrade Spock2 to milestone 5"
"gradle","gradle","https://github.com/gradle/gradle/pull/16687","closed","2021-03-31T14:36:22Z","2021-03-31T16:03:49Z","jjohannes","Update plugin-publish-plugin to version 0.14.0"
"gradle","gradle","https://github.com/gradle/gradle/pull/16684","closed","2021-03-31T09:12:56Z","2021-03-31T14:28:17Z","rieske","Merge release into master"
"gradle","gradle","https://github.com/gradle/gradle/pull/16678","closed","2021-03-30T18:58:53Z","2021-03-31T12:35:57Z","paplorinc","Update test-distribution plugin to version 2.0.2-rc-2"
"gradle","gradle","https://github.com/gradle/gradle/pull/16674","closed","2021-03-30T12:28:48Z","2021-03-31T08:20:49Z","rieske","Infer Groovy 3 jars from classpath if found, otherwise declare external dependencies"
"gradle","gradle","https://github.com/gradle/gradle/pull/16681","closed","2021-03-31T02:53:51Z","2021-03-31T03:45:19Z","blindpirate","Remove mergify as we don't need it now"
"gradle","gradle","https://github.com/gradle/gradle/pull/16664","closed","2021-03-29T18:16:17Z","2021-03-30T19:53:08Z","bamboo","Fix backward compatibility of `AbstractReportTask`"
"gradle","gradle","https://github.com/gradle/gradle/pull/16669","closed","2021-03-30T08:51:38Z","2021-03-30T17:38:07Z","wolfs","Enable Gretty plugin smoke test"
"gradle","gradle","https://github.com/gradle/gradle/pull/16675","closed","2021-03-30T14:09:03Z","2021-03-30T16:51:41Z","bmuskalla","Remove old labels from issue templates"
"gradle","gradle","https://github.com/gradle/gradle/pull/16670","closed","2021-03-30T09:22:35Z","2021-03-30T14:28:10Z","eskatos","Upgrade tested AGP version"
"gradle","gradle","https://github.com/gradle/gradle/pull/16643","closed","2021-03-25T13:47:13Z","2021-03-30T12:19:54Z","ljacomet","Make fully empty lock state delete the lock file"
"gradle","gradle","https://github.com/gradle/gradle/pull/16668","closed","2021-03-30T06:28:21Z","2021-03-30T11:19:18Z","blindpirate","Exclude master on release pipeline and release on master pipeline"
"gradle","gradle","https://github.com/gradle/gradle/pull/16601","closed","2021-03-21T11:43:01Z","2021-03-30T10:07:22Z","wolfs","Upgrade Gradle profiler to latest alpha version"
"gradle","gradle","https://github.com/gradle/gradle/pull/16662","closed","2021-03-29T15:01:13Z","2021-03-29T17:01:11Z","bamboo","Update wrapper to latest nightly"
