org,repository,url,state,created_at,merged_at,user.login,title
"gradle","gradle","https://github.com/gradle/gradle/pull/13533","closed","2020-06-19T11:54:10Z","2020-06-20T12:54:02Z","bamboo","Capture `Jar` manifest generator in the configuration cache"
"gradle","native-samples","https://github.com/gradle/native-samples/pull/35","open","2020-06-23T12:23:52Z",,"Brenne","Enhancement of cpp header-only-library sample"
"gradle","gradle","https://github.com/gradle/gradle/pull/13559","closed","2020-06-23T11:22:58Z","2020-06-23T11:39:57Z","wolfs","Polish file-system watching not supported messages"
"gradle","gradle","https://github.com/gradle/gradle/pull/13549","closed","2020-06-22T09:48:55Z","2020-06-22T16:52:20Z","wolfs","Gracefully handle when file-events library can't be loaded"
"gradle","native-platform","https://github.com/gradle/native-platform/pull/230","closed","2020-06-19T17:29:57Z","2020-06-22T16:35:22Z","wolfs","Enable dependency verification"
"gradle","gradle","https://github.com/gradle/gradle/pull/13545","closed","2020-06-20T14:53:26Z","2020-06-22T15:21:03Z","eskatos","Let the configuration cache report be a self contained file"
"gradle","gradle","https://github.com/gradle/gradle/pull/13525","closed","2020-06-19T07:24:29Z","2020-06-20T08:55:04Z","eskatos","Update tested AGP versions"
"gradle","gradle","https://github.com/gradle/gradle/pull/13517","closed","2020-06-18T16:16:31Z","2020-06-20T08:41:15Z","eskatos","Style the configuration cache problems report"
"gradle","native-platform","https://github.com/gradle/native-platform/pull/228","closed","2020-06-19T15:17:43Z","2020-06-19T15:56:08Z","wolfs","Upgradle to 6.5"
"gradle","gradle-profiler","https://github.com/gradle/gradle-profiler/pull/208","closed","2020-06-16T18:55:57Z","2020-06-19T15:28:02Z","paragchandra","Add support for specifying number of iterations in a scenario definition"
"gradle","gradle","https://github.com/gradle/gradle/pull/13516","closed","2020-06-18T14:41:53Z","2020-06-19T14:21:46Z","eskatos","Another round of configuration cache documentation"
"gradle","gradle","https://github.com/gradle/gradle/pull/13527","closed","2020-06-19T09:37:13Z","2020-06-19T14:21:12Z","jjohannes","User better APIs in build logic"
"gradle","gradle","https://github.com/gradle/gradle/pull/13512","closed","2020-06-18T12:48:11Z","2020-06-19T09:35:15Z","wolfs","BuildLayout should detect `master/settings.gradle` in current directory"
"gradle","gradle","https://github.com/gradle/gradle/pull/13505","closed","2020-06-18T09:37:24Z","2020-06-18T13:53:08Z","melix","Support more notations for `MavenPublication#artifact()`"
"gradle","gradle","https://github.com/gradle/gradle/pull/13502","closed","2020-06-18T07:58:33Z","2020-06-18T10:55:36Z","eskatos","Make test in WarTaskIntegrationTest properly isolated"
"gradle","gradle","https://github.com/gradle/gradle/pull/13489","closed","2020-06-17T13:53:28Z","2020-06-18T08:32:27Z","melix","Fix Java attribute describer when category is missing"
"gradle","gradle","https://github.com/gradle/gradle/pull/13443","closed","2020-06-16T15:14:59Z","2020-06-16T20:56:49Z","eskatos","Enhance user messages when using the configuration cache"
"gradle","gradle","https://github.com/gradle/gradle/pull/13437","closed","2020-06-16T09:34:05Z","2020-06-16T15:32:47Z","bmuskalla","Include root cause of exceptions from annotation proccessors"
