org,repository,url,state,created_at,merged_at,user.login,title
"gradle","bt-dev-prod-data-collector","https://github.com/gradle/bt-dev-prod-data-collector/pull/3","closed","2021-05-31T07:58:05Z","2021-05-31T15:01:10Z","wolfs","Adjust memory settings"
"gradle","gradle","https://github.com/gradle/gradle/pull/17318","closed","2021-05-31T10:56:24Z","2021-05-31T13:53:22Z","snoopcheri","Update to GE & TD Gradle plugins to latest RC versions"
"gradle","gradle","https://github.com/gradle/gradle/pull/17308","closed","2021-05-28T07:44:41Z","2021-05-28T15:15:12Z","rieske","Add reproducer tests for dependency substitution with buildSrc issues"
"gradle","gradle","https://github.com/gradle/gradle/pull/17241","closed","2021-05-20T10:22:37Z","2021-05-28T09:59:12Z","eshepelyuk","fix: improve detection of msys2/mingw in startup and wrapper scripts"
"gradle","gradle","https://github.com/gradle/gradle/pull/17259","closed","2021-05-24T08:37:45Z","2021-05-28T10:21:11Z","rieske","Smoke test Gradle Kotlin Plugin 1.5.0"
"gradle","gradle","https://github.com/gradle/gradle/pull/17296","closed","2021-05-27T08:41:15Z","2021-05-27T15:53:10Z","jjohannes","Fully support substituting an enforced dependency through a project"
"gradle","gradle","https://github.com/gradle/gradle/pull/17299","closed","2021-05-27T14:36:07Z","2021-05-27T22:56:52Z","JLLeitschuh","Add CII Best Practices Badge"
"gradle","gradle-enterprise-build-config-samples","https://github.com/gradle/gradle-enterprise-build-config-samples/pull/91","closed","2021-05-20T21:08:31Z","2021-05-27T20:18:31Z","jthurne","Add support for configuring Gradle Enterprise settings via system properties"
"gradle","gradle","https://github.com/gradle/gradle/pull/17267","closed","2021-05-25T14:07:58Z","2021-05-27T08:51:13Z","mlopatkin","Re-use version selector parser to check for dynamic version when publishing"
"gradle","gradle","https://github.com/gradle/gradle/pull/17284","closed","2021-05-26T05:18:42Z","2021-05-27T09:33:14Z","blindpirate","Remove unused def modifier"
"gradle","bt-dev-prod-data-collector","https://github.com/gradle/bt-dev-prod-data-collector/pull/2","closed","2021-05-25T05:06:56Z","2021-05-27T08:00:23Z","blindpirate","Extract long running test classes"
"gradle","gradle","https://github.com/gradle/gradle/pull/17288","closed","2021-05-26T11:15:43Z","2021-05-27T06:03:43Z","marcusschroeder","Fix doc which uses wrong property to disable a violation rule"
"gradle","gradle","https://github.com/gradle/gradle/pull/17283","closed","2021-05-26T05:16:45Z","2021-05-26T08:14:57Z","blindpirate","Remove unused def modifier"
"gradle","gradle","https://github.com/gradle/gradle/pull/17282","closed","2021-05-26T05:10:40Z","2021-05-26T07:19:23Z","blindpirate","Remove unused assignment"
"gradle","gradle","https://github.com/gradle/gradle/pull/17214","closed","2021-05-18T10:14:32Z","2021-05-20T16:23:26Z","eskatos","Upgrade tested AGP versions"
"gradle","gradle","https://github.com/gradle/gradle/pull/17256","closed","2021-05-24T05:31:01Z","2021-05-24T12:53:29Z","marcphilipp","Add @gradle/ge-test-distribution to JVM testing subprojects"
"gradle","gradle","https://github.com/gradle/gradle/pull/17244","closed","2021-05-21T01:32:55Z","2021-05-21T05:54:56Z","blindpirate","Update GPG keyring"
"gradle","gradle","https://github.com/gradle/gradle/pull/17240","closed","2021-05-20T09:54:14Z","2021-05-21T06:31:09Z","rieske","Allow precompiled Kotlin settings plugins to have plugins block"
"gradle","gradle","https://github.com/gradle/gradle/pull/17219","closed","2021-05-18T14:08:36Z","2021-05-19T13:16:33Z","rieske","Update Spock to version 2 release"
"gradle","android-cache-fix-gradle-plugin","https://github.com/gradle/android-cache-fix-gradle-plugin/pull/172","closed","2021-05-18T19:19:00Z","2021-05-18T19:42:24Z","runningcode","Add support for AGP 7.0.0 Beta 1"
"gradle","gradle","https://github.com/gradle/gradle/pull/17216","closed","2021-05-18T12:44:12Z","2021-05-18T19:30:22Z","big-guy","Fix performance regression due to convention mapping changes"
"gradle","gradle","https://github.com/gradle/gradle/pull/17211","closed","2021-05-18T04:47:37Z","2021-05-18T06:57:09Z","blindpirate","Don't update green-master/green-release on pre-tested commit branch"
"gradle","gradle","https://github.com/gradle/gradle/pull/17202","closed","2021-05-16T01:57:50Z","2021-05-16T07:34:13Z","GreenRecycleBin","Prefer parseInt(String), etc., to valueOf(String)"
